Scenario,Category,Sub - mission,Level,Action,Entity,From,Time,Location,Task Objective,Objective function,Hard Constrains,Soft Constrains (Preferences)
"The satellite images show an adversary ship is sailing at location K, at 300 miles north west of own base which needs to be intercepted and interrogated. This may require engagement using SSMs in case of hostile action by the adversary’s ship. The mission is to be executed in the next 48 hours. The fleet must deploy suitable ship for this mission in the next 24 hours.  The speed of 25 knots (including availability of Propulsion systems and PGD systems), endurance of at least 07 days (Ration; Fuel; RO plant)",Mission,,Fleet,Select K out of N,Ship,Fleet,24 hours,K,Interrogation and interception,Minimum risk,"Capability,Speed,Endurance,Ration,Fuel,Spares availability","Ship class,Fleet availability"
"Satellite images show an enemy ship at location K, about 300 miles northwest of its base. We need to stop and question it, and might have to use missiles if it turns hostile. The mission has to happen in the next 48 hours, so we have to send a suitable ship in the next 24 hours. The ship needs to go at a speed of 25 knots, have enough fuel and supplies for at least 7 days, including food, fuel, and a system to produce fresh water (RO plant).",Mission,,Fleet,Select K out of N,Ship,Fleet,24 hours,K,Interrogation and interception,Minimum risk,"Capability,Speed,Endurance,Ration,Fuel,Spares availability","Ship class,Fleet availability"
"Satellite pics caught an enemy ship near spot K, far from its base. We've got to check it out, and if it gets nasty, we might need to use missiles. The mission has to go down in 48 hours, so we're sending a good ship in the next 24. It needs to go 25 knots, have enough fuel and supplies for 7 days - food, fuel, and a way to make fresh water (RO plant).",Mission,,Fleet,Select K out of N,Ship,Fleet,24 hours,K,Interrogation and interception,Minimum risk,"Capability,Speed,Endurance,Ration,Fuel,Spares availability","Ship class,Fleet availability"
"Satellite images spotted an enemy ship at location K, around 300 miles northwest of its home base. We need to intercept and question it, and if things go south, we might have to use missiles. The mission has to happen in the next 48 hours, so we're sending out a suitable ship within the next 24 hours. The ship should move at 25 knots, with operational propulsion and PGD systems, and it should have supplies lasting at least 7 days - including food, fuel, and a Reverse Osmosis (RO) plant for fresh water.",Mission,,Fleet,Select K out of N,Ship,Fleet,24 hours,K,Interrogation and interception,Minimum risk,"Capability,Speed,Endurance,Ration,Fuel,Spares availability","Ship class,Fleet availability"
"Satellite pictures show an enemy ship at location K, roughly 300 miles northwest of its base. We need to intercept and question it, and if it becomes a threat, missiles might be necessary. The mission has to be completed in the next 48 hours, so a suitable ship must be deployed within the next 24 hours. The chosen ship should have a speed of 25 knots, functioning propulsion and PGD systems, and an endurance of at least 7 days, with provisions such as food, fuel, and a Reverse Osmosis (RO) plant for fresh water.",Mission,,Fleet,Select K out of N,Ship,Fleet,24 hours,K,Interrogation and interception,Minimum risk,"Capability,Speed,Endurance,Ration,Fuel,Spares availability","Ship class,Fleet availability"
"An adversary ship has been spotted at location K, 300 miles northwest of its own base in satellite images. We need to intercept and gather information, and if the situation turns hostile, we might need to use missiles. The mission is scheduled for the next 48 hours, so we're sending a suitable ship within the next 24 hours. The ship needs to have a speed of 25 knots, operational propulsion and PGD systems, and an endurance of at least 7 days with provisions like food, fuel, and a Reverse Osmosis (RO) plant for fresh water.",Mission,,Fleet,Select K out of N,Ship,Fleet,24 hours,K,Interrogation and interception,Minimum risk,"Capability,Speed,Endurance,Ration,Fuel,Spares availability","Ship class,Fleet availability"
"Satellite images reveal an enemy ship at location K, situated about 300 miles northwest of its base. The task is to intercept and question it, and in case of hostility, we may need to engage with missiles. The mission is set for the next 48 hours, prompting the deployment of a suitable ship within the next 24 hours. The ship should have a speed of 25 knots, operational propulsion and PGD systems, and an endurance of at least 7 days, including provisions like food, fuel, and a Reverse Osmosis (RO) plant for fresh water.",Mission,,Fleet,Select K out of N,Ship,Fleet,24 hours,K,Interrogation and interception,Minimum risk,"Capability,Speed,Endurance,Ration,Fuel,Spares availability","Ship class,Fleet availability"
"A ship is sailing at 300 miles North West from the base, which needs to be stop and check. In case of any hostile action, the SSMs can be used. The mission need to be complete in the next 48 hours, and the ships must deploy within the 24 hours. The ship must be ready for atleast 7 day mission (ration, fuel and ro plant), and need to have a speed of 25 knots.",Mission,,Fleet,Select K out of N,Ship,Fleet,24 hours,K,Interrogation and interception,Minimum risk,"Capability,Speed,Endurance,Ration,Fuel,Spares availability","Ship class,Fleet availability"
"Based on satellite-derived intelligence, a hostile maritime entity has been discerned at geographical coordinates denoted as K, positioning itself at an approximate radial distance of 300 nautical miles northwest from its established home base. The imperative at hand entails the interception and subsequent interrogation of said adversary vessel, with the contemplation of deploying Surface-to-Surface Missiles (SSMs) in the event of an escalated, confrontational scenario. The operational timeline for the orchestration of this mission is confined to the ensuing 48 hours, necessitating the expeditious selection and dispatch of a vessel deemed fitting for this purpose within the preceding 24-hour interval. The identified vessel ought to exhibit a propulsion velocity of no less than 25 knots, incorporating seamlessly operational Propulsion and PGD systems, and must demonstrate an operational sustainability encompassing a minimum of 7 days. This sustained operational viability encompasses essential logistical provisions, notably encompassing rations, fuel, and a technologically equipped Reverse Osmosis (RO) plant for freshwater synthesis.",Mission,,Fleet,Select K out of N,Ship,Fleet,24 hours,K,Interrogation and interception,Minimum risk,"Capability,Speed,Endurance,Ration,Fuel,Spares availability","Ship class,Fleet availability"
"Satellite pics found an enemy ship at location K, 300 miles northwest of its base. We gotta check it out and might use missiles if things get bad. Mission's in 48 hours, so we need a suitable ship in the next 24. The ship should go 25 knots, have enough supplies for 7 days, including food, fuel, and a system to make fresh water (RO plant).",Mission,,Fleet,Select K out of N,Ship,Fleet,24 hours,K,Interrogation and interception,Minimum risk,"Capability,Speed,Endurance,Ration,Fuel,Spares availability","Ship class,Fleet availability"
"For the above stated mission, ship ABC needs to be evaluated. This should include evaluating the capacity and capability of its MGRS firing. The target reliability for this evaluation is to be set at 0.9. The range, consistency and accuracy must be the other criteria to be focused on for this evaluation. Current operating status of the MGRS can be easily evaluated at the ship level using parameters - P 1, P 2, P 3. The risk score for the mission must not be more than 11/25. P4 and P5 parameters should be used for evaluating the risk score.",Mission,,Ship,Evaluate,Ship,Fleet,Immediate,Sea,Missile firing,Minimum risk,"Reliability,Risk score",Not Available
"We need to assess ship ABC for a mission. One crucial aspect is examining its gun capabilities, considering factors like capacity, ability to hit targets reliably (with a target reliability of 0.9), and the gun's range, consistency, and accuracy. To evaluate the gun's current state, we can look at parameters P1, P2, and P3 at the ship level. Additionally, we must ensure that the risk score for the mission stays below 11 out of 25, taking into account parameters P4 and P5.",Mission,,Ship,Evaluate,Ship,Fleet,Immediate,Sea,Missile firing,Minimum risk,"Reliability,Risk score",Not Available
"We have to evaluate ship ABC for this mission. We need to focus on its gun capabilities, considering aspects like capacity, reliability (with a target reliability of 0.9), and factors like range, consistency, and accuracy. To gauge the current status of the guns, we can use parameters P1, P2, and P3 at the ship level. Additionally, we must ensure that the risk score for the mission doesn't go over 11 out of 25, taking into account parameters P4 and P5.",Mission,,Ship,Evaluate,Ship,Fleet,Immediate,Sea,Missile firing,Minimum risk,"Reliability,Risk score",Not Available
"Ship ABC needs a check for the upcoming mission. We're specifically looking into its gun features, examining capacity, reliability (aiming for 0.9), and factors like range, consistency, and accuracy. To assess the current state of the guns, we'll be using parameters P1, P2, and P3 at the ship level. Also, we need to keep the risk score for the mission below 11 out of 25, considering parameters P4 and P5.",Mission,,Ship,Evaluate,Ship,Fleet,Immediate,Sea,Missile firing,Minimum risk,"Reliability,Risk score",Not Available
"Ship ABC needs a thorough evaluation for this mission. We're particularly interested in its gun capabilities, considering factors such as capacity, reliability (aiming for 0.9), and attributes like range, consistency, and accuracy. To assess the present state of the guns, we'll be relying on parameters P1, P2, and P3 at the ship level. Moreover, it's crucial to keep the risk score for the mission below 11 out of 25, factoring in parameters P4 and P5.",Mission,,Ship,Evaluate,Ship,Fleet,Immediate,Sea,Missile firing,Minimum risk,"Reliability,Risk score",Not Available
"Pursuant to the upcoming mission, an evaluation of ship ABC is imperative. The primary focus lies in scrutinizing its artillery capabilities, encompassing considerations of capacity, reliability (with a target reliability threshold of 0.9), and nuances related to range, consistency, and accuracy. To appraise the current operational status of the weaponry, parameters P1, P2, and P3 at the ship level shall be employed. Furthermore, it is imperative to ensure that the mission's risk score does not surpass 11 out of 25, taking into account parameters P4 and P5.",Mission,,Ship,Evaluate,Ship,Fleet,Immediate,Sea,Missile firing,Minimum risk,"Reliability,Risk score",Not Available
"In light of the impending mission, a comprehensive assessment of vessel ABC is necessitated. The pivotal aspect under scrutiny pertains to the prowess of its armaments, involving an in-depth analysis of capacity, reliability (with a targeted reliability level of 0.9), and intricacies associated with range, consistency, and accuracy. To gauge the prevailing operational status of the weaponry, parameters P1, P2, and P3 at the ship level shall be utilized. Additionally, stringent measures must be in place to ensure that the mission's risk score remains below 11 out of 25, duly considering parameters P4 and P5.",Mission,,Ship,Evaluate,Ship,Fleet,Immediate,Sea,Missile firing,Minimum risk,"Reliability,Risk score",Not Available
"For the upcoming mission, we need to assess ship ABC. The primary focus is on its gun capabilities, considering factors like capacity, reliability (with a target reliability of 0.9), and features such as range, consistency, and accuracy. To evaluate the current status of the guns, we'll use parameters P1, P2, and P3 at the ship level. Additionally, we must ensure that the risk score for the mission doesn't exceed 11 out of 25, taking into account parameters P4 and P5.",Mission,,Ship,Evaluate,Ship,Fleet,Immediate,Sea,Missile firing,Minimum risk,"Reliability,Risk score",Not Available
"In preparation for the upcoming mission, it is essential to conduct a thorough evaluation of ship ABC. The key aspect of this assessment is to examine its gun capabilities, taking into consideration factors such as capacity, reliability (with a target reliability of 0.9), and attributes like range, consistency, and accuracy. To gauge the present state of the guns, we will utilize parameters P1, P2, and P3 at the ship level. Furthermore, it is imperative to uphold stringent criteria to ensure that the risk score for the mission does not surpass 11 out of 25, duly considering parameters P4 and P5.",Mission,,Ship,Evaluate,Ship,Fleet,Immediate,Sea,Missile firing,Minimum risk,"Reliability,Risk score",Not Available
"In anticipation of the impending mission, a comprehensive evaluation of ship ABC is required. The primary emphasis is on assessing its gun capabilities, which involves considerations of capacity, reliability (with a target reliability of 0.9), and specific features such as range, consistency, and accuracy. To evaluate the current operational status of the guns, parameters P1, P2, and P3 at the ship level will be employed. It is crucial to maintain a strict standard to ensure that the risk score for the mission remains below 11 out of 25, taking into account parameters P4 and P5.",Mission,,Ship,Evaluate,Ship,Fleet,Immediate,Sea,Missile firing,Minimum risk,"Reliability,Risk score",Not Available
"The mission is now approaching the cruising phase, for which only 2 GTs need to be run for the next 20 hours. As per the criteria for balancing loads, 1 GT from front and 1 GT from aft needs to run. Select the best suitable combination to achieve 0.9 reliability criteria with risk score of not more than 7/18. If more than one GTs fulfil the above criteria, then choose the combination such that the working hours of all GTs are balanced.",Mission,,Equipment,Select K out of N,Equipment,Ships,Immediate,Sea,Maintenance scheduling,Minimum risk,"Balancing loads,Reliability,Risk score","Working hours,Manpower availability"
"Amidst the upcoming mission's transition to the cruising phase, only 2 GTs need to be operational for the next 20 hours. Ensuring load balancing, one GT from the front and one from the aft should be running. The objective is to select a combination achieving a reliability of 0.9 with a risk score not exceeding 7/18. If multiple GTs meet the criteria, prioritize combinations with balanced working hours for all GTs.",Mission,,Equipment,Select K out of N,Equipment,Ships,Immediate,Sea,Maintenance scheduling,Minimum risk,"Balancing loads,Reliability,Risk score","Working hours,Manpower availability"
"In preparation for the cruising phase, only 2 GTs need to be operational for the next 20 hours. Balancing loads necessitates one GT from the front and one from the aft to run. The goal is to select the most suitable combination ensuring a reliability of 0.9 with a risk score below 7/18. If multiple GTs meet the criteria, prioritize combinations with balanced working hours for all GTs.",Mission,,Equipment,Select K out of N,Equipment,Ships,Immediate,Sea,Maintenance scheduling,Minimum risk,"Balancing loads,Reliability,Risk score","Working hours,Manpower availability"
"As the mission enters the cruising phase, only 2 GTs need to operate for the next 20 hours. Ensuring load balancing, one GT from the front and one from the aft should be running. The objective is to select a combination ensuring a reliability of 0.9 with a risk score not exceeding 7/18. If multiple GTs meet the criteria, prioritize combinations with balanced working hours for all GTs.",Mission,,Equipment,Select K out of N,Equipment,Ships,Immediate,Sea,Maintenance scheduling,Minimum risk,"Balancing loads,Reliability,Risk score","Working hours,Manpower availability"
"Preceding the mission's transition to the cruising phase, only 2 GTs need to be operational for the next 20 hours. Ensuring load balancing, one GT from the front and one from the aft should be running. The goal is to select the most suitable combination to achieve a reliability of 0.9 with a risk score not exceeding 7/18. If multiple GTs meet the criteria, prioritize combinations with balanced working hours for all GTs.",Mission,,Equipment,Select K out of N,Equipment,Ships,Immediate,Sea,Maintenance scheduling,Minimum risk,"Balancing loads,Reliability,Risk score","Working hours,Manpower availability"
"During the mission's transition to the cruising phase, only 2 GTs need to be operational for the next 20 hours. Ensuring load balancing, one GT from the front and one from the aft should be running. The goal is to select the best combination to achieve a reliability of 0.9 with a risk score below 7/18. If multiple GTs meet the criteria, prioritize combinations with balanced working hours for all GTs.",Mission,,Equipment,Select K out of N,Equipment,Ships,Immediate,Sea,Maintenance scheduling,Minimum risk,"Balancing loads,Reliability,Risk score","Working hours,Manpower availability"
"As the mission's cruising phase approaches, only 2 GTs need to be operational for the next 20 hours. Ensuring load balancing, one GT from the front and one from the aft should be running. The objective is to select a combination ensuring a reliability of 0.9 with a risk score not exceeding 7/18. If multiple GTs meet the criteria, prioritize combinations with balanced working hours for all GTs.",Mission,,Equipment,Select K out of N,Equipment,Ships,Immediate,Sea,Maintenance scheduling,Minimum risk,"Balancing loads,Reliability,Risk score","Working hours,Manpower availability"
"During the upcoming mission's cruising phase, only 2 GTs need to be operational for the next 20 hours. Balancing loads requires one GT from the front and one from the aft to run. The objective is to select a combination achieving a reliability of 0.9 with a risk score not exceeding 7/18. If multiple GTs meet the criteria, prioritize combinations with balanced working hours for all GTs.",Mission,,Equipment,Select K out of N,Equipment,Ships,Immediate,Sea,Maintenance scheduling,Minimum risk,"Balancing loads,Reliability,Risk score","Working hours,Manpower availability"
"As the mission approaches its cruising phase, only 2 GTs need to operate for the next 20 hours. Ensuring load balancing, one GT from the front and one from the aft should be running. The goal is to select the most suitable combination ensuring a reliability of 0.9 with a risk score below 7/18. If multiple GTs meet the criteria, prioritize combinations with balanced working hours for all GTs.",Mission,,Equipment,Select K out of N,Equipment,Ships,Immediate,Sea,Maintenance scheduling,Minimum risk,"Balancing loads,Reliability,Risk score","Working hours,Manpower availability"
"Amidst the mission's transition to the cruising phase, only 2 GTs need to be operational for the next 20 hours. Ensuring load balancing, one GT from the front and one from the aft should be running. The objective is to select a combination achieving a reliability of 0.9 with a risk score not exceeding 7/18. If multiple GTs meet the criteria, prioritize combinations with balanced working hours for all GTs.",Mission,,Equipment,Select K out of N,Equipment,Ships,Immediate,Sea,Maintenance scheduling,Minimum risk,"Balancing loads,Reliability,Risk score","Working hours,Manpower availability"
"The fleet needs to schedule plan for refit of ships and submarines present in the command in upcoming annual refit conference. Two operational dry docks are available in yard, no more that three ship/submarine should come for refit at a time. MoM are to be released with prioritizing ship/submarine within a week.  Repair workshop at the time of ship’s refit need to be fully operational and available with more than 80% manpower strength. Spares required during overhaul of equipment may arrive two months before the commencement of the refit plan.",Maintenance,,Fleet,Select K out of N,Ship,Fleet,7 days,Yard,Maintenance scheduling,Maximum conformance,"Manpower availability,Spares availability",Ship class
"The fleet needs to schedule a plan for the refit of ships and submarines at the upcoming annual conference. There are two dry docks available, and no more than three vessels should undergo refit simultaneously. Memorandums of understanding (MoMs) will be released within a week, prioritizing the vessels. Repair workshops must maintain at least 80% manpower during refits. Spare parts for equipment overhauls will be delivered two months before the refit begins.",Maintenance,,Fleet,Select K out of N,Ship,Fleet,7 days,Yard,Maintenance scheduling,Maximum conformance,"Manpower availability,Spares availability",Ship class
"The fleet is planning the annual refit for ships and submarines. Two dry docks are available, but only three vessels can be refitted concurrently. MoMs will be issued within a week to prioritize the vessels. It is imperative that repair workshops maintain over 80% of their manpower during refits. Spare parts for equipment overhaul should be procured two months prior to the refit commencement.",Maintenance,,Fleet,Select K out of N,Ship,Fleet,7 days,Yard,Maintenance scheduling,Maximum conformance,"Manpower availability,Spares availability",Ship class
"The upcoming annual refit conference requires meticulous planning for both ships and submarines. There are only two operational dry docks in the yard, limiting simultaneous refits to three vessels. MoMs, crucial for prioritizing vessels, must be released within a week. The repair workshops must operate with no less than 80% manpower during refits to ensure efficiency. Additionally, spare parts necessary for equipment overhauls should be procured and available at least two months before the refit schedule begins.",Maintenance,,Fleet,Select K out of N,Ship,Fleet,7 days,Yard,Maintenance scheduling,Maximum conformance,"Manpower availability,Spares availability",Ship class
"The fleet must plan the annual refit for its ships and submarines. With only two dry docks available, no more than three vessels can be refitted simultaneously. MoMs will be distributed within a week to prioritize vessels, while ensuring that repair workshops maintain at least 80% manpower during refits. Spare parts for equipment overhauls are expected to arrive two months prior to the commencement of refits.",Maintenance,,Fleet,Select K out of N,Ship,Fleet,7 days,Yard,Maintenance scheduling,Maximum conformance,"Manpower availability,Spares availability",Ship class
"Planning the annual refit for ships and submarines is underway. The limited availability of two dry docks necessitates careful coordination, with a maximum of three vessels undergoing refit concurrently. MoMs will be dispatched promptly to prioritize vessels, while repair workshops are required to operate with a minimum of 80% manpower during refits. Adequate spare parts for equipment overhauls are to be procured and delivered two months prior to the scheduled refit start date.",Maintenance,,Fleet,Select K out of N,Ship,Fleet,7 days,Yard,Maintenance scheduling,Maximum conformance,"Manpower availability,Spares availability",Ship class
"The annual refit conference demands thorough planning for both ships and submarines. Only two operational dry docks are available, restricting simultaneous refits to three vessels. MoMs must be issued within a week to effectively prioritize vessels. Maintaining a workforce of at least 80% in repair workshops during refits is crucial. Furthermore, it's imperative to procure and have available all necessary spare parts for equipment overhauls at least two months prior to the refit initiation.",Maintenance,,Fleet,Select K out of N,Ship,Fleet,7 days,Yard,Maintenance scheduling,Maximum conformance,"Manpower availability,Spares availability",Ship class
"As the annual refit conference approaches, the fleet must plan for the maintenance of ships and submarines. With only two dry docks operational, no more than three vessels can be refitted simultaneously. MoMs will be released within a week to prioritize vessels, while ensuring that repair workshops maintain at least 80% manpower during refits. Spare parts for equipment overhauls are expected to arrive two months before the refit schedule begins.",Maintenance,,Fleet,Select K out of N,Ship,Fleet,7 days,Yard,Maintenance scheduling,Maximum conformance,"Manpower availability,Spares availability",Ship class
"The fleet is preparing for the annual refit of its ships and submarines. Limited by two dry docks, simultaneous refits are capped at three vessels. MoMs will be promptly issued to prioritize vessels, while repair workshops must retain a minimum of 80% manpower during refits. Procurement and delivery of spare parts for equipment overhauls are expected two months prior to the commencement of the refit schedule.",Maintenance,,Fleet,Select K out of N,Ship,Fleet,7 days,Yard,Maintenance scheduling,Maximum conformance,"Manpower availability,Spares availability",Ship class
"Ahead of the annual refit conference, meticulous planning is required for both ships and submarines. The fleet must work within the constraints of two dry docks, allowing only three vessels to be refitted concurrently. MoMs must be expedited to prioritize vessels within a week. It's imperative to maintain a workforce of at least 80% in repair workshops during refits. Additionally, all necessary spare parts for equipment overhauls must be procured and available two months before the scheduled refit start.",Maintenance,,Fleet,Select K out of N,Ship,Fleet,7 days,Yard,Maintenance scheduling,Maximum conformance,"Manpower availability,Spares availability",Ship class
