Scenario,Category,Sub - mission,Level,Action,Entity,From,Time,Location,Task Objective,Objective function,Hard Constrains,Soft Constrains (Preferences)
"The ship has been ordered to sail during the annual maintenance period wherein maintenance routines were being undertaken on various equipment. Workshop has been directed to finish the maintenance task and make the ship sea worthy within 48 hours of notice. In order to stick to the new promulgated timelines, the quality of work done by workshop must not deviate more than 10%.",Maintenance,,Ship,Evaluate,Workshop,Fleet,48 hours,Workshop,Maintenance scheduling,Minimum time,"Reliability,Conformance ",Activity sequence
"The ship has been ordered to sail during the annual maintenance period wherein maintenance routines were being undertaken on various equipment. The workshop has been directed to finish the maintenance task and make the ship seaworthy within 48 hours of notice. In order to stick to the new promulgated timelines, the quality of work done by the workshop must not deviate more than 10%.",Maintenance,,Ship,Evaluate,Workshop,Fleet,48 hours,Workshop,Maintenance scheduling,Minimum time,"Reliability,Conformance ",Activity sequence
"During the annual maintenance period, the ship has received orders to sail. Various equipment maintenance routines were ongoing at the time. The workshop has been given a directive to complete the maintenance tasks and ensure the ship is seaworthy within 48 hours of notice. Adherence to the newly established timelines requires that the quality of work performed by the workshop does not deviate by more than 10%.",Maintenance,,Ship,Evaluate,Workshop,Fleet,48 hours,Workshop,Maintenance scheduling,Minimum time,"Reliability,Conformance ",Activity sequence
"Amidst the annual maintenance period, the ship has been mandated to sail. Maintenance routines for various equipment were being executed. The workshop has been tasked with completing the maintenance assignments and ensuring the ship is seaworthy within 48 hours of notice. To adhere to the newly established timelines, the quality of work performed by the workshop must not deviate more than 10%.",Maintenance,,Ship,Evaluate,Workshop,Fleet,48 hours,Workshop,Maintenance scheduling,Minimum time,"Reliability,Conformance ",Activity sequence
"While undergoing annual maintenance, the ship has been given orders to sail. Maintenance routines for various equipment were ongoing during this period. The workshop has been directed to finalize the maintenance tasks and guarantee the ship's seaworthiness within 48 hours of notice. Compliance with the newly enforced timelines necessitates that the workshop's work quality does not deviate by more than 10%.",Maintenance,,Ship,Evaluate,Workshop,Fleet,48 hours,Workshop,Maintenance scheduling,Minimum time,"Reliability,Conformance ",Activity sequence
"The ship has been instructed to sail amidst the annual maintenance period, during which maintenance routines for various equipment were in progress. The workshop has been given the task of completing the maintenance assignments and ensuring the ship is seaworthy within 48 hours of notice. To meet the new timelines, the workshop must ensure that the quality of work does not deviate by more than 10%.",Maintenance,,Ship,Evaluate,Workshop,Fleet,48 hours,Workshop,Maintenance scheduling,Minimum time,"Reliability,Conformance ",Activity sequence
"Amidst the annual maintenance period, orders have been issued for the ship to sail. Maintenance routines for various equipment were underway at the time. The workshop has been tasked with completing the maintenance tasks and ensuring the ship's seaworthiness within 48 hours of notice. Adhering to the newly introduced timelines requires that the quality of work performed by the workshop maintains a deviation of no more than 10%.",Maintenance,,Ship,Evaluate,Workshop,Fleet,48 hours,Workshop,Maintenance scheduling,Minimum time,"Reliability,Conformance ",Activity sequence
"The ship has been mandated to sail during the annual maintenance period, amidst ongoing maintenance routines for various equipment. The workshop has received instructions to finalize the maintenance tasks and ensure the ship's seaworthiness within 48 hours of notice. To comply with the newly implemented timelines, the workshop must ensure that the quality of work performed does not deviate by more than 10%.",Maintenance,,Ship,Evaluate,Workshop,Fleet,48 hours,Workshop,Maintenance scheduling,Minimum time,"Reliability,Conformance ",Activity sequence
"During the annual maintenance period, the ship has been ordered to set sail while various equipment maintenance routines were being carried out. The workshop has been directed to complete the maintenance tasks and ensure the ship is seaworthy within 48 hours of notice. To meet the new timelines, the workshop must maintain a work quality deviation of no more than 10%.",Maintenance,,Ship,Evaluate,Workshop,Fleet,48 hours,Workshop,Maintenance scheduling,Minimum time,"Reliability,Conformance ",Activity sequence
"The ship has been directed to sail during the annual maintenance period, amidst ongoing maintenance routines for various equipment. The workshop has been instructed to complete the maintenance tasks and ensure the ship's seaworthiness within 48 hours of notice. Adhering to the newly established timelines requires that the quality of work performed by the workshop does not deviate by more than 10%.",Maintenance,,Ship,Evaluate,Workshop,Fleet,48 hours,Workshop,Maintenance scheduling,Minimum time,"Reliability,Conformance ",Activity sequence
"A ship named XYZ, during its operational cycle, has initiated condition-based inspections of shock mounts for various pumps and gas turbines. Some shock mount readings are approaching the warning threshold. The ship is scheduled to embark on a voyage within the next 48 hours, with an anticipated operational duration of 7 days. It's imperative to replace these shock mounts promptly to maintain mission reliability at 0.9.",Maintenance,,Equipment,Evaluate,Equipment,Ships,48 hours,Ship,Interrogation and interception,Minimum time,"Spares availability,Reliability,Conformance ",Activity sequence
"A vessel designated as DEF, currently in its operational cycle, has commenced condition-based inspections on shock mounts for various pumps and gas turbines. Certain shock mount readings are nearing the warning threshold. The vessel is set to depart within 48 hours for a mission lasting 7 days. Urgent replacement of these shock mounts is essential to uphold mission reliability at 0.9.",Maintenance,,Equipment,Evaluate,Equipment,Ships,48 hours,Ship,Interrogation and interception,Minimum time,"Spares availability,Reliability,Conformance ",Activity sequence
"During its operational cycle, ship MNO has initiated condition-based inspections on shock mounts for various pumps and gas turbines. Some shock mount readings are approaching the warning threshold. The ship is slated to sail within the next 48 hours for a mission spanning 7 days. Swift replacement of these shock mounts is imperative to maintain mission reliability at 0.9.",Maintenance,,Equipment,Evaluate,Equipment,Ships,48 hours,Ship,Interrogation and interception,Minimum time,"Spares availability,Reliability,Conformance ",Activity sequence
"Ship PQR, amidst its operational cycle, has commenced condition-based inspections on shock mounts for various pumps and gas turbines. A few shock mount readings are nearing the warning threshold. The ship is scheduled to depart within the next 48 hours for a 7-day mission. Immediate replacement of these shock mounts is necessary to sustain mission reliability at 0.9.",Maintenance,,Equipment,Evaluate,Equipment,Ships,48 hours,Ship,Interrogation and interception,Minimum time,"Spares availability,Reliability,Conformance ",Activity sequence
"A ship known as LMN, currently in its operational cycle, has initiated condition-based inspections on shock mounts for various pumps and gas turbines. Certain shock mount readings are approaching the warning threshold. The ship is set to embark on a mission within the next 48 hours, expected to last 7 days. Urgent replacement of these shock mounts is essential to uphold mission reliability at 0.9.",Maintenance,,Equipment,Evaluate,Equipment,Ships,48 hours,Ship,Interrogation and interception,Minimum time,"Spares availability,Reliability,Conformance ",Activity sequence
"Ship GHI, amidst its operational cycle, has commenced condition-based inspections on shock mounts for various pumps and gas turbines. Some shock mount readings are nearing the warning threshold. The ship is slated to sail within the next 48 hours for a mission spanning 7 days. Immediate replacement of these shock mounts is necessary to maintain mission reliability at 0.9.",Maintenance,,Equipment,Evaluate,Equipment,Ships,48 hours,Ship,Interrogation and interception,Minimum time,"Spares availability,Reliability,Conformance ",Activity sequence
"Vessel JKL, during its operational cycle, has initiated condition-based inspections on shock mounts for various pumps and gas turbines. A few shock mount readings are approaching the warning threshold. The vessel is scheduled to depart within the next 48 hours for a mission lasting 7 days. Swift replacement of these shock mounts is imperative to sustain mission reliability at 0.9.",Maintenance,,Equipment,Evaluate,Equipment,Ships,48 hours,Ship,Interrogation and interception,Minimum time,"Spares availability,Reliability,Conformance ",Activity sequence
"Ship STU, currently in its operational cycle, has commenced condition-based inspections on shock mounts for various pumps and gas turbines. Certain shock mount readings are nearing the warning threshold. The ship is set to embark on a mission within the next 48 hours, expected to last 7 days. Urgent replacement of these shock mounts is essential to uphold mission reliability at 0.9.",Maintenance,,Equipment,Evaluate,Equipment,Ships,48 hours,Ship,Interrogation and interception,Minimum time,"Spares availability,Reliability,Conformance ",Activity sequence
"During its operational cycle, ship VWX has initiated condition-based inspections on shock mounts for various pumps and gas turbines. Some shock mount readings are approaching the warning threshold. The ship is scheduled to depart within the next 48 hours for a 7-day mission. Immediate replacement of these shock mounts is necessary to maintain mission reliability at 0.9.",Maintenance,,Equipment,Evaluate,Equipment,Ships,48 hours,Ship,Interrogation and interception,Minimum time,"Spares availability,Reliability,Conformance ",Activity sequence
"Ship EFG, amidst its operational cycle, has commenced condition-based inspections on shock mounts for various pumps and gas turbines. A few shock mount readings are nearing the warning threshold. The ship is slated to sail within the next 48 hours for a mission spanning 7 days. Swift replacement of these shock mounts is imperative to sustain mission reliability at 0.9.",Maintenance,,Equipment,Evaluate,Equipment,Ships,48 hours,Ship,Interrogation and interception,Minimum time,"Spares availability,Reliability,Conformance ",Activity sequence
"Satellite images reveal an enemy ship at location K, around 300 miles northwest of its home base. We're gearing up to intercept and investigate, prepared to use missiles if necessary. The mission is scheduled within the next 48 hours, prompting the deployment of a suitable ship within the next 24 hours. The chosen vessel should have a speed of 25 knots, including operational propulsion and PGD systems. It must ensure an endurance of at least 7 days, encompassing supplies such as rations, fuel, and a Reverse Osmosis (RO) plant for freshwater. Further details about specific ship requirements and potential threats are currently being assessed.",Mission,,Fleet,Select K out of N,Ship,Fleet,24 hours,K,Interrogation and interception,Minimum risk,"Capability,Speed,Endurance,Ration,Fuel,Spares availability","Ship class,Fleet availability"
"Based on satellite images, we've detected an adversary ship at location K, approximately 300 miles northwest of its home base. Our response involves intercepting and investigating, with a readiness to use missiles if required. The mission is slated for the next 48 hours, necessitating the deployment of an apt vessel within the coming 24 hours. The selected ship should maintain a speed of 25 knots, equipped with operational propulsion systems. It must also guarantee an endurance of at least 7 days, encompassing essential supplies like rations, fuel, and a Reverse Osmosis (RO) plant for freshwater. Further examination of specific ship requirements and potential threats is currently underway.",Mission,,Fleet,Select K out of N,Ship,Fleet,24 hours,K,Interrogation and interception,Minimum risk,"Capability,Speed,Endurance,Ration,Fuel,Spares availability","Ship class,Fleet availability"
"Satellite images depict an adversary ship at location K, situated 300 miles northwest of our base. Intercepting and interrogating the ship is imperative. Engagement with SSMs might be necessary in the event of hostility. The mission must be completed within the next 48 hours. Deployment of a suitable ship by the fleet is required within the next 24 hours. The ship must maintain a speed of 25 knots, with operational propulsion and PGD systems, and an endurance of at least 7 days (including provisions such as ration, fuel, and RO plant).",Mission,,Fleet,Select K out of N,Ship,Fleet,24 hours,K,Interrogation and interception,Minimum risk,"Capability,Speed,Endurance,Ration,Fuel,Spares availability","Ship class,Fleet availability"
"An adversary vessel has been detected via satellite imagery, navigating at location K, approximately 300 miles northwest of our base. Intercepting and investigating the vessel is of utmost importance. If the situation escalates, engagement with SSMs might be necessary. The mission is scheduled for completion within the next 48 hours, requiring the deployment of a suitable ship within the next 24 hours. The selected ship must travel at a speed of 25 knots, with fully operational propulsion and PGD systems, and an endurance of at least 7 days (including provisions such as ration, fuel, and RO plant).",Mission,,Fleet,Select K out of N,Ship,Fleet,24 hours,K,Interrogation and interception,Minimum risk,"Capability,Speed,Endurance,Ration,Fuel,Spares availability","Ship class,Fleet availability"
"Satellite surveillance has identified an adversary ship at location K, situated 300 miles northwest of our base. Intercepting and interrogating the vessel is necessary. If hostile actions occur, engagement with SSMs may be required. The mission's completion is expected within the next 48 hours, prompting the fleet to deploy a suitable ship within the next 24 hours. The chosen vessel must maintain a speed of 25 knots, equipped with operational propulsion and PGD systems, and possess an endurance of at least 7 days (including provisions such as ration, fuel, and RO plant).",Mission,,Fleet,Select K out of N,Ship,Fleet,24 hours,K,Interrogation and interception,Minimum risk,"Capability,Speed,Endurance,Ration,Fuel,Spares availability","Ship class,Fleet availability"
"A hostile ship has been detected through satellite imagery, navigating at location K, around 300 miles northwest of our base. Intercepting and interrogating the ship is essential. In case of hostility, engagement with SSMs may be necessary. The mission must be executed within the next 48 hours, requiring the fleet to deploy a suitable ship within the next 24 hours. The selected ship must travel at a speed of 25 knots, equipped with operational propulsion and PGD systems, and maintain an endurance of at least 7 days (including provisions such as ration, fuel, and RO plant).",Mission,,Fleet,Select K out of N,Ship,Fleet,24 hours,K,Interrogation and interception,Minimum risk,"Capability,Speed,Endurance,Ration,Fuel,Spares availability","Ship class,Fleet availability"
"Satellite surveillance has identified an adversary ship at location K, positioned approximately 300 miles northwest of our base. Intercepting and interrogating the ship is imperative. If necessary, engagement with SSMs might be required. The mission's completion is slated within the next 48 hours, necessitating the deployment of a suitable ship within the next 24 hours. The chosen vessel must operate at a speed of 25 knots, equipped with fully functional propulsion and PGD systems, and have an endurance of at least 7 days (including provisions such as ration, fuel, and RO plant).",Mission,,Fleet,Select K out of N,Ship,Fleet,24 hours,K,Interrogation and interception,Minimum risk,"Capability,Speed,Endurance,Ration,Fuel,Spares availability","Ship class,Fleet availability"
"An adversary ship has been identified via satellite images, navigating at location K, approximately 300 miles northwest of our base. Intercepting and interrogating the vessel is a critical mission. Engagement with SSMs may be necessary in case of hostility. The mission's deadline is within the next 48 hours, prompting the fleet to deploy a suitable ship within the next 24 hours. The chosen vessel must travel at a speed of 25 knots, equipped with operational propulsion and PGD systems, and possess an endurance of at least 7 days (including provisions such as ration, fuel, and RO plant).",Mission,,Fleet,Select K out of N,Ship,Fleet,24 hours,K,Interrogation and interception,Minimum risk,"Capability,Speed,Endurance,Ration,Fuel,Spares availability","Ship class,Fleet availability"
"Satellite surveillance has detected an adversary ship at location K, situated approximately 300 miles northwest of our base. Intercepting and interrogating the vessel is vital. Engagement with SSMs may be necessary in hostile situations. The mission's deadline is within the next 48 hours, requiring the fleet to deploy a suitable ship within the next 24 hours. The selected vessel must travel at a speed of 25 knots, equipped with operational propulsion and PGD systems, and have an endurance of at least 7 days (including provisions such as ration, fuel, and RO plant).",Mission,,Fleet,Select K out of N,Ship,Fleet,24 hours,K,Interrogation and interception,Minimum risk,"Capability,Speed,Endurance,Ration,Fuel,Spares availability","Ship class,Fleet availability"
"A hostile ship has been detected via satellite imagery, sailing at location K, approximately 300 miles northwest of our base. Intercepting and interrogating the vessel is paramount. In case of hostility, engagement with SSMs may be necessary. The mission's completion is required within the next 48 hours, prompting the fleet to deploy a suitable ship within the next 24 hours. The chosen vessel must operate at a speed of 25 knots, equipped with fully functional propulsion and PGD systems, and maintain an endurance of at least 7 days (including provisions such as ration, fuel, and RO plant).",Mission,,Fleet,Select K out of N,Ship,Fleet,24 hours,K,Interrogation and interception,Minimum risk,"Capability,Speed,Endurance,Ration,Fuel,Spares availability","Ship class,Fleet availability"
"Satellite surveillance has identified an adversary ship at location K, positioned approximately 300 miles northwest of our base. Intercepting and interrogating the ship is essential. If necessary, engagement with SSMs might be required. The mission's completion is expected within the next 48 hours, requiring the fleet to deploy a suitable ship within the next 24 hours. The chosen vessel must operate at a speed of 25 knots, equipped with fully functional propulsion and PGD systems, and have an endurance of at least 7 days (including provisions such as ration, fuel, and RO plant).",Mission,,Fleet,Select K out of N,Ship,Fleet,24 hours,K,Interrogation and interception,Minimum risk,"Capability,Speed,Endurance,Ration,Fuel,Spares availability","Ship class,Fleet availability"
"A hostile ship has been detected via satellite imagery, navigating at location K, around 300 miles northwest of our base. Intercepting and interrogating the ship is essential. In case of hostility, engagement with SSMs may be necessary. The mission must be executed within the next 48 hours, requiring the fleet to deploy a suitable ship within the next 24 hours. The selected ship must travel at a speed of 25 knots, equipped with fully operational propulsion and PGD systems, and maintain an endurance of at least 7 days (including provisions such as ration, fuel, and RO plant).",Mission,,Fleet,Select K out of N,Ship,Fleet,24 hours,K,Interrogation and interception,Minimum risk,"Capability,Speed,Endurance,Ration,Fuel,Spares availability","Ship class,Fleet availability"
"Satellite surveillance has identified an adversary ship at location K, situated approximately 300 miles northwest of our base. Intercepting and interrogating the ship is vital. Engagement with SSMs may be necessary in hostile situations. The mission's deadline is within the next 48 hours, requiring the fleet to deploy a suitable ship within the next 24 hours. The chosen vessel must operate at a speed of 25 knots, equipped with fully operational propulsion and PGD systems, and possess an endurance of at least 7 days (including provisions such as ration, fuel, and RO plant).",Mission,,Fleet,Select K out of N,Ship,Fleet,24 hours,K,Interrogation and interception,Minimum risk,"Capability,Speed,Endurance,Ration,Fuel,Spares availability","Ship class,Fleet availability"
"An adversary ship has been detected via satellite images, navigating at location K, approximately 300 miles northwest of our base. Intercepting and interrogating the vessel is a critical mission. Engagement with SSMs may be necessary in case of hostility. The mission's deadline is within the next 48 hours, prompting the fleet to deploy a suitable ship within the next 24 hours. The chosen vessel must travel at a speed of 25 knots, equipped with operational propulsion and PGD systems, and possess an endurance of at least 7 days (including provisions such as ration, fuel, and RO plant).",Mission,,Fleet,Select K out of N,Ship,Fleet,24 hours,K,Interrogation and interception,Minimum risk,"Capability,Speed,Endurance,Ration,Fuel,Spares availability","Ship class,Fleet availability"
"Satellite surveillance has detected an adversary ship at location K, situated approximately 300 miles northwest of our base. Intercepting and interrogating the vessel is paramount. Engagement with SSMs may be necessary in hostile situations. The mission's deadline is within the next 48 hours, requiring the fleet to deploy a suitable ship within the next 24 hours. The selected vessel must operate at a speed of 25 knots, equipped with fully operational propulsion and PGD systems, and maintain an endurance of at least 7 days (including provisions such as ration, fuel, and RO plant).",Mission,,Fleet,Select K out of N,Ship,Fleet,24 hours,K,Interrogation and interception,Minimum risk,"Capability,Speed,Endurance,Ration,Fuel,Spares availability","Ship class,Fleet availability"
"A hostile ship has been detected via satellite imagery, sailing at location K, approximately 300 miles northwest of our base. Intercepting and interrogating the vessel is paramount. In case of hostility, engagement with SSMs may be necessary. The mission's completion is required within the next 48 hours, prompting the fleet to deploy a suitable ship within the next 24 hours. The chosen vessel must operate at a speed of 25 knots, equipped with fully functional propulsion and PGD systems, and possess an endurance of at least 7 days (including provisions such as ration, fuel, and RO plant).",Mission,,Fleet,Select K out of N,Ship,Fleet,24 hours,K,Interrogation and interception,Minimum risk,"Capability,Speed,Endurance,Ration,Fuel,Spares availability","Ship class,Fleet availability"
"Satellite surveillance has identified an adversary ship at location K, positioned approximately 300 miles northwest of our base. Intercepting and interrogating the ship is essential. If necessary, engagement with SSMs might be required. The mission's completion is expected within the next 48 hours, requiring the fleet to deploy a suitable ship within the next 24 hours. The chosen vessel must operate at a speed of 25 knots, equipped with fully functional propulsion and PGD systems, and maintain an endurance of at least 7 days (including provisions such as ration, fuel, and RO plant).",Mission,,Fleet,Select K out of N,Ship,Fleet,24 hours,K,Interrogation and interception,Minimum risk,"Capability,Speed,Endurance,Ration,Fuel,Spares availability","Ship class,Fleet availability"
"A hostile ship has been detected via satellite imagery, navigating at location K, around 300 miles northwest of our base. Intercepting and interrogating the ship is essential. In case of hostility, engagement with SSMs may be necessary. The mission must be executed within the next 48 hours, requiring the fleet to deploy a suitable ship within the next 24 hours. The selected ship must travel at a speed of 25 knots, equipped with fully operational propulsion and PGD systems, and maintain an endurance of at least 7 days (including provisions such as ration, fuel, and RO plant).",Mission,,Fleet,Select K out of N,Ship,Fleet,24 hours,K,Interrogation and interception,Minimum risk,"Capability,Speed,Endurance,Ration,Fuel,Spares availability","Ship class,Fleet availability"
